{
  "$schema": "http://pathways.rmi.org/schema/pathwayTimeseries.v2.json",
  "id": "ACE-RAS-2024_timeseries",
  "pathwayId": ["ACE-RAS-2024"],
  "name": "Regional Aspiration Scenario (RAS) Timeseries Data",
  "description": "ASEAN-specific pathway exploring impact of unconditional NDCs and long-term pledges.",
  "publication": {
    "title": {
      "full": "8th ASEAN Energy Outlook",
      "short": "AEO8"
    },
    "publisher": {
      "full": "ASEAN Centre for Energy",
      "short": "ACE"
    },
    "year": 2024,
    "city": "Jakarta",
    "issn": "2963-539X",
    "links": [
      {
        "description": "Report",
        "url": "https://aseanenergy.org/publications/the-8th-asean-energy-outlook/"
      }
    ]
  },
  "pathwayName": "Regional Aspiration Scenario (RAS)",
  "emissionsScope": "CO2e (unspecified GHGs)",
  "data": [
    {
      "year": 2022,
      "geography": "ASEAN",
      "sector": "power",
      "sectorSegment": ["Power generation"],
      "technology": null,
      "metric": "absoluteEmissions",
      "value": 769.7,
      "unit": "MtCO2e"
    },
    {
      "year": 2025,
      "geography": "ASEAN",
      "sector": "power",
      "sectorSegment": ["Power generation"],
      "technology": null,
      "metric": "absoluteEmissions",
      "value": 672.9,
      "unit": "MtCO2e"
    },
    {
      "year": 2030,
      "geography": "ASEAN",
      "sector": "power",
      "sectorSegment": ["Power generation"],
      "technology": null,
      "metric": "absoluteEmissions",
      "value": 651.2,
      "unit": "MtCO2e"
    },
    {
      "year": 2035,
      "geography": "ASEAN",
      "sector": "power",
      "sectorSegment": ["Power generation"],
      "technology": null,
      "metric": "absoluteEmissions",
      "value": 539.2,
      "unit": "MtCO2e"
    },
    {
      "year": 2040,
      "geography": "ASEAN",
      "sector": "power",
      "sectorSegment": ["Power generation"],
      "technology": null,
      "metric": "absoluteEmissions",
      "value": 462.9,
      "unit": "MtCO2e"
    },
    {
      "year": 2045,
      "geography": "ASEAN",
      "sector": "power",
      "sectorSegment": ["Power generation"],
      "technology": null,
      "metric": "absoluteEmissions",
      "value": 361.6,
      "unit": "MtCO2e"
    },
    {
      "year": 2050,
      "geography": "ASEAN",
      "sector": "power",
      "sectorSegment": ["Power generation"],
      "technology": null,
      "metric": "absoluteEmissions",
      "value": 258.3,
      "unit": "MtCO2e"
    },
    {
      "year": 2022,
      "geography": "ASEAN",
      "sector": "power",
      "sectorSegment": ["Power generation"],
      "technology": "biomass",
      "metric": "capacity",
      "value": 7.6,
      "unit": "GW"
    },
    {
      "year": 2025,
      "geography": "ASEAN",
      "sector": "power",
      "sectorSegment": ["Power generation"],
      "technology": "biomass",
      "metric": "capacity",
      "value": 11.4,
      "unit": "GW"
    },
    {
      "year": 2030,
      "geography": "ASEAN",
      "sector": "power",
      "sectorSegment": ["Power generation"],
      "technology": "biomass",
      "metric": "capacity",
      "value": 15,
      "unit": "GW"
    },
    {
      "year": 2035,
      "geography": "ASEAN",
      "sector": "power",
      "sectorSegment": ["Power generation"],
      "technology": "biomass",
      "metric": "capacity",
      "value": 23.7,
      "unit": "GW"
    },
    {
      "year": 2040,
      "geography": "ASEAN",
      "sector": "power",
      "sectorSegment": ["Power generation"],
      "technology": "biomass",
      "metric": "capacity",
      "value": 37.3,
      "unit": "GW"
    },
    {
      "year": 2045,
      "geography": "ASEAN",
      "sector": "power",
      "sectorSegment": ["Power generation"],
      "technology": "biomass",
      "metric": "capacity",
      "value": 50.7,
      "unit": "GW"
    },
    {
      "year": 2050,
      "geography": "ASEAN",
      "sector": "power",
      "sectorSegment": ["Power generation"],
      "technology": "biomass",
      "metric": "capacity",
      "value": 88.7,
      "unit": "GW"
    },
    {
      "year": 2022,
      "geography": "ASEAN",
      "sector": "power",
      "sectorSegment": ["Power generation"],
      "technology": "coal",
      "metric": "capacity",
      "value": 107.1,
      "unit": "GW"
    },
    {
      "year": 2025,
      "geography": "ASEAN",
      "sector": "power",
      "sectorSegment": ["Power generation"],
      "technology": "coal",
      "metric": "capacity",
      "value": 112.9,
      "unit": "GW"
    },
    {
      "year": 2030,
      "geography": "ASEAN",
      "sector": "power",
      "sectorSegment": ["Power generation"],
      "technology": "coal",
      "metric": "capacity",
      "value": 124.8,
      "unit": "GW"
    },
    {
      "year": 2035,
      "geography": "ASEAN",
      "sector": "power",
      "sectorSegment": ["Power generation"],
      "technology": "coal",
      "metric": "capacity",
      "value": 110.1,
      "unit": "GW"
    },
    {
      "year": 2040,
      "geography": "ASEAN",
      "sector": "power",
      "sectorSegment": ["Power generation"],
      "technology": "coal",
      "metric": "capacity",
      "value": 109.7,
      "unit": "GW"
    },
    {
      "year": 2045,
      "geography": "ASEAN",
      "sector": "power",
      "sectorSegment": ["Power generation"],
      "technology": "coal",
      "metric": "capacity",
      "value": 108.9,
      "unit": "GW"
    },
    {
      "year": 2050,
      "geography": "ASEAN",
      "sector": "power",
      "sectorSegment": ["Power generation"],
      "technology": "coal",
      "metric": "capacity",
      "value": 106,
      "unit": "GW"
    },
    {
      "year": 2022,
      "geography": "ASEAN",
      "sector": "power",
      "sectorSegment": ["Power generation"],
      "technology": "gas",
      "metric": "capacity",
      "value": 89.9,
      "unit": "GW"
    },
    {
      "year": 2025,
      "geography": "ASEAN",
      "sector": "power",
      "sectorSegment": ["Power generation"],
      "technology": "gas",
      "metric": "capacity",
      "value": 100.5,
      "unit": "GW"
    },
    {
      "year": 2030,
      "geography": "ASEAN",
      "sector": "power",
      "sectorSegment": ["Power generation"],
      "technology": "gas",
      "metric": "capacity",
      "value": 141.7,
      "unit": "GW"
    },
    {
      "year": 2035,
      "geography": "ASEAN",
      "sector": "power",
      "sectorSegment": ["Power generation"],
      "technology": "gas",
      "metric": "capacity",
      "value": 166.2,
      "unit": "GW"
    },
    {
      "year": 2040,
      "geography": "ASEAN",
      "sector": "power",
      "sectorSegment": ["Power generation"],
      "technology": "gas",
      "metric": "capacity",
      "value": 196.1,
      "unit": "GW"
    },
    {
      "year": 2045,
      "geography": "ASEAN",
      "sector": "power",
      "sectorSegment": ["Power generation"],
      "technology": "gas",
      "metric": "capacity",
      "value": 242.9,
      "unit": "GW"
    },
    {
      "year": 2050,
      "geography": "ASEAN",
      "sector": "power",
      "sectorSegment": ["Power generation"],
      "technology": "gas",
      "metric": "capacity",
      "value": 289.9,
      "unit": "GW"
    },
    {
      "year": 2022,
      "geography": "ASEAN",
      "sector": "power",
      "sectorSegment": ["Power generation"],
      "technology": "geothermal",
      "metric": "capacity",
      "value": 4.3,
      "unit": "GW"
    },
    {
      "year": 2025,
      "geography": "ASEAN",
      "sector": "power",
      "sectorSegment": ["Power generation"],
      "technology": "geothermal",
      "metric": "capacity",
      "value": 5.7,
      "unit": "GW"
    },
    {
      "year": 2030,
      "geography": "ASEAN",
      "sector": "power",
      "sectorSegment": ["Power generation"],
      "technology": "geothermal",
      "metric": "capacity",
      "value": 8.2,
      "unit": "GW"
    },
    {
      "year": 2035,
      "geography": "ASEAN",
      "sector": "power",
      "sectorSegment": ["Power generation"],
      "technology": "geothermal",
      "metric": "capacity",
      "value": 8.3,
      "unit": "GW"
    },
    {
      "year": 2040,
      "geography": "ASEAN",
      "sector": "power",
      "sectorSegment": ["Power generation"],
      "technology": "geothermal",
      "metric": "capacity",
      "value": 11.5,
      "unit": "GW"
    },
    {
      "year": 2045,
      "geography": "ASEAN",
      "sector": "power",
      "sectorSegment": ["Power generation"],
      "technology": "geothermal",
      "metric": "capacity",
      "value": 16.8,
      "unit": "GW"
    },
    {
      "year": 2050,
      "geography": "ASEAN",
      "sector": "power",
      "sectorSegment": ["Power generation"],
      "technology": "geothermal",
      "metric": "capacity",
      "value": 24.7,
      "unit": "GW"
    },
    {
      "year": 2022,
      "geography": "ASEAN",
      "sector": "power",
      "sectorSegment": ["Power generation"],
      "technology": "hydro",
      "metric": "capacity",
      "value": 62.3,
      "unit": "GW"
    },
    {
      "year": 2025,
      "geography": "ASEAN",
      "sector": "power",
      "sectorSegment": ["Power generation"],
      "technology": "hydro",
      "metric": "capacity",
      "value": 73.6,
      "unit": "GW"
    },
    {
      "year": 2030,
      "geography": "ASEAN",
      "sector": "power",
      "sectorSegment": ["Power generation"],
      "technology": "hydro",
      "metric": "capacity",
      "value": 95,
      "unit": "GW"
    },
    {
      "year": 2035,
      "geography": "ASEAN",
      "sector": "power",
      "sectorSegment": ["Power generation"],
      "technology": "hydro",
      "metric": "capacity",
      "value": 112.8,
      "unit": "GW"
    },
    {
      "year": 2040,
      "geography": "ASEAN",
      "sector": "power",
      "sectorSegment": ["Power generation"],
      "technology": "hydro",